id,title,description,availability,condition,price,link,image_link,brand
203,Mazda 3 Axela 2004-2009,car radio conversion kit for Mazda 3 Axela,In Stock,new,6000,http://amanivehiclesounds.co.ke/product/mazda-3-axela-2004-2009,http://amanivehiclesounds.co.ke/uploads/product/Mazda-3-Axela-2004-2009-001.png,Others
204,Mazda 3 Axela 2010-2013,car radio fascia Conversion kit for Mazda 3 Axella,In Stock,new,6500,http://amanivehiclesounds.co.ke/product/mazda-3-axela-2010-2013,http://amanivehiclesounds.co.ke/uploads/product/Mazda-3-Axela-2010-2013-001.png,Others
205,Radio Trim kit for Mazda Premacy,Radio conversion kit for Mazda 5 Premacy  2005-2010,In Stock,new,6500,http://amanivehiclesounds.co.ke/product/radio-trim-kit-for-mazda-premacy,http://amanivehiclesounds.co.ke/uploads/product/Radio-Trim-kit-for-Mazda-Premacy-001.png,Others
206,Fascia for Mazda 5 Premacy 2005-2010,Car Radio Dash Kit Fascia Console Mazda 5 Premacy,In Stock,new,6500,http://amanivehiclesounds.co.ke/product/fascia-for-mazda-5-premacy-2005-2010,http://amanivehiclesounds.co.ke/uploads/product/Fascia-for-Mazda-5-Premacy-2005-2010-001.png,Others
207,Mazda 6 Attenza 2008-2013,Mazda 6 Attenza double Din Radio Conversion kit,In Stock,new,6500,http://amanivehiclesounds.co.ke/product/mazda-6-attenza-2008-2013,http://amanivehiclesounds.co.ke/uploads/product/Mazda-6-Attenza-2008-2013-001.png,Others
208,Mazda 8 Year 2006+Radio fitting panel,Car Radio Conversion kit for Mazda 8,In Stock,new,7000,http://amanivehiclesounds.co.ke/product/mazda-8-year-2006radio-fitting-panel,http://amanivehiclesounds.co.ke/uploads/product/Mazda-8-Year-2006+Radio-fitting-panel-001.png,Others
209,Console for Mazda Premacy Year 2002,Radio conversion kit for Mazda  Premacy,In Stock,new,5000,http://amanivehiclesounds.co.ke/product/console-for-mazda-premacy-year-2002,http://amanivehiclesounds.co.ke/uploads/product/Console-for-Mazda-Premacy-Year-2002-001.png,Others
210,Console  for Mazda Verisa Year 2005+,Mazda Verisa Radio Console,In Stock,new,7500,http://amanivehiclesounds.co.ke/product/console-for-mazda-verisa-year-2005,http://amanivehiclesounds.co.ke/uploads/product/Console--for-Mazda-Verisa-Year-2005+-001.png,Others
211,Console for 2012 Mitsubishi Outlander,Car Radio Conversion Kit for Mistubishi Outlander sport,In Stock,new,9500,http://amanivehiclesounds.co.ke/product/console-for-2012-mitsubishi-outlander,http://amanivehiclesounds.co.ke/uploads/product/Console-for-2012-Mitsubishi-Outlander-001.png,Others
212,Mitsubishi Outlander Radio Console,2008-2012 Car Radio Double Din Conversion kit for Mitsubishi Outlander,In Stock,new,9500,http://amanivehiclesounds.co.ke/product/mitsubishi-outlander-radio-console,http://amanivehiclesounds.co.ke/uploads/product/Mitsubishi-Outlander-Radio-Console-001.png,Others
213,Radio Conversion Kit for Mitsubishi,Double Din Car Radio Fascia Console for 2007+ Mitsubishi Lancer X Galant Fortis,In Stock,new,6500,http://amanivehiclesounds.co.ke/product/radio-conversion-kit-for-mitsubishi,http://amanivehiclesounds.co.ke/uploads/product/Radio-Conversion-Kit-for-Mitsubishi-001.png,Others
214,Mitsubishi Outlander 2014 radio frame,Car Radio Conversion kit for Mitsubishi Outlander 2014,In Stock,new,9500,http://amanivehiclesounds.co.ke/product/mitsubishi-outlander-2014-radio-frame,http://amanivehiclesounds.co.ke/uploads/product/Mitsubishi-Outlander-2014-radio-frame-001.png,Others
215,Console for 2010  Mitsubishi Pajero,Mistubishi Pajero Car Radio Conversion kit,In Stock,new,6500,http://amanivehiclesounds.co.ke/product/console-for-2010-mitsubishi-pajero,http://amanivehiclesounds.co.ke/uploads/product/Console-for-2010--Mitsubishi-Pajero-001.png,Others
216,Radio Conversion kit for Nissan B15,Car Radio Conversion Kit For Sentra B15,In Stock,new,6000,http://amanivehiclesounds.co.ke/product/radio-conversion-kit-for-nissan-b15,http://amanivehiclesounds.co.ke/uploads/product/Radio-Conversion-kit-for-Nissan-B15-001.png,Others
217,Nissan March 2010-2013 Fascia Panel,Double Din Radio Conversion Kit for Nissan March & Renault pulse,In Stock,new,6000,http://amanivehiclesounds.co.ke/product/nissan-march-2010-2013-fascia-panel,http://amanivehiclesounds.co.ke/uploads/product/Nissan-March-2010-2013-Fascia-Panel-001.png,Others
218,Radio Panel for 2014+ Nissan Xtrail,Car Radio Conversion Kit For Nissan Xtrail,In Stock,new,9000,http://amanivehiclesounds.co.ke/product/radio-panel-for-2014-nissan-xtrail,http://amanivehiclesounds.co.ke/uploads/product/Radio-Panel-for-2014+-Nissan-Xtrail-001.png,Others
219,Peugeot 406 Car Radio Fascia trim kit,One Din Car Radio Console Conversion kit For Peugeot 406.,In Stock,new,5500,http://amanivehiclesounds.co.ke/product/peugeot-406-car-radio-fascia-trim-kit,http://amanivehiclesounds.co.ke/uploads/product/Peugeot-406-Car-Radio-Fascia-trim-kit-001.png,Others
220,Fascia Installation kit for  Porsche,Porche Cayenne Turbo Radio installation Fascia Console for 2009,In Stock,new,10000,http://amanivehiclesounds.co.ke/product/fascia-installation-kit-for-porsche,http://amanivehiclesounds.co.ke/uploads/product/Fascia-Installation-kit-for--Porsche-001.png,Others
221,Toyota Prado Gx J150 2010,Car Radio Conversion Kit for Toyota Prado GX 150,In Stock,new,9000,http://amanivehiclesounds.co.ke/product/toyota-prado-gx-j150-2010,http://amanivehiclesounds.co.ke/uploads/product/Toyota-Prado-Gx-J150-2010-001.png,Others
222,Subaru legacy Radio console,Car Radio Installation kit for Subaru Legacy 2010+,In Stock,new,7000,http://amanivehiclesounds.co.ke/product/subaru-legacy-radio-console,http://amanivehiclesounds.co.ke/uploads/product/Subaru-legacy-Radio-console-001.png,Others
223,Subaru Legacy Outback 2015+ Fascia,Car Radio fascia console for Subaru legacy Outback 2015+,In Stock,new,8500,http://amanivehiclesounds.co.ke/product/subaru-legacy-outback-2015-fascia,http://amanivehiclesounds.co.ke/uploads/product/Subaru-Legacy-Outback-2015+-Fascia-001.png,Others
224,Radio Console for 2013 Suzuki Alto,Car Radio Installation Console kit for SUZUKI ALTO 2013,In Stock,new,6500,http://amanivehiclesounds.co.ke/product/radio-console-for-2013-suzuki-alto,http://amanivehiclesounds.co.ke/uploads/product/Radio-Console-for-2013-Suzuki-Alto-001.png,Others
225,Suzuki Grand Vitara 2005 Trim Kit,Suzuki Grand Vitara 2005 Double Din Car Radio Conversion kit,In Stock,new,6000,http://amanivehiclesounds.co.ke/product/suzuki-grand-vitara-2005-trim-kit,http://amanivehiclesounds.co.ke/uploads/product/Suzuki-Grand-Vitara-2005-Trim-Kit-001.png,Others
226,Radio Fascia for 2009 Suzuki Swift,Radio Console for Suzuki Swift 2009,In Stock,new,6000,http://amanivehiclesounds.co.ke/product/radio-fascia-for-2009-suzuki-swift,http://amanivehiclesounds.co.ke/uploads/product/Radio-Fascia-for-2009-Suzuki-Swift-001.png,Others
227,VW Touran Passat Golf Tiguan Console,2 Din Radio Conversion Kit for Volkswagen Touran Passat Golf 2009,In Stock,new,6500,http://amanivehiclesounds.co.ke/product/vw-touran-passat-golf-tiguan-console,http://amanivehiclesounds.co.ke/uploads/product/VW-Touran-Passat-Golf-Tiguan-Console-001.png,Others
228,Console for 2002 to 2011 VW Touareg,Car Radio Installation Conversion kit for VW TOUAREG 2011,In Stock,new,6500,http://amanivehiclesounds.co.ke/product/console-for-2002-to-2011-vw-touareg,http://amanivehiclesounds.co.ke/uploads/product/Console-for-2002-to-2011-VW-Touareg-001.png,Others
229,VW Touareg 2009+ Radio Fascia,Car Radio Fascia Conversion kit for VW TOUAREG 2009+,In Stock,new,6500,http://amanivehiclesounds.co.ke/product/vw-touareg-2009-radio-fascia,http://amanivehiclesounds.co.ke/uploads/product/VW-Touareg-2009+-Radio-Fascia-001.png,Others
230,2007 - 2013 Toyota Corolla Trim kit,Stereo Dash Kit Panel Plate for Toyota Corolla Radio Install,In Stock,new,6500,http://amanivehiclesounds.co.ke/product/2007-2013-toyota-corolla-trim-kit,http://amanivehiclesounds.co.ke/uploads/product/2007---2013-Toyota-Corolla-Trim-kit-001.png,Others
231,Toyota Corolla Nze Fielder Fascia,Aftermarket radio replacement Kit for Toyota Corolla NZE Fielder 2001 to 2006,In Stock,new,5000,http://amanivehiclesounds.co.ke/product/toyota-corolla-nze-fielder-fascia,http://amanivehiclesounds.co.ke/uploads/product/Toyota-Corolla-Nze-Fielder-Fascia-001.png,Others
232,Toyota Harrier Lexus 1997-2003 Panel,One din Car Radio Fascia Installation Kit for Toyota Harrier & Lexus RX300,In Stock,new,6500,http://amanivehiclesounds.co.ke/product/toyota-harrier-lexus-1997-2003-panel,http://amanivehiclesounds.co.ke/uploads/product/Toyota-Harrier-Lexus-1997-2003-Panel-001.png,Others
233,Fascia kit for Toyota mark ii 2005,Toyota Mark II 2005 Double Din Radio Conversion kit,In Stock,new,6000,http://amanivehiclesounds.co.ke/product/fascia-kit-for-toyota-mark-ii-2005,http://amanivehiclesounds.co.ke/uploads/product/Fascia-kit-for-Toyota-mark-ii-2005-001.png,Others
234,Console for Toyota Harrier & Lexus,Radio Conversion kit For Toyota harrier (2003-2012) Lexus (2003-2009).,In Stock,new,6500,http://amanivehiclesounds.co.ke/product/console-for-toyota-harrier-lexus,http://amanivehiclesounds.co.ke/uploads/product/Console-for-Toyota-Harrier-&-Lexus-001.png,Others
235,Toyota Revolution  Hilux 2015+ trim,Toyota Revo & Hillux Radio Conversion kit,In Stock,new,6000,http://amanivehiclesounds.co.ke/product/toyota-revolution-hilux-2015-trim,http://amanivehiclesounds.co.ke/uploads/product/Toyota-Revolution- Hilux-2015+-trim-001.png,Others
236,Panel for Toyota Allion  & Premio,Radio Conversion kit for Toyota Premio & Allion 240 245,In Stock,new,6500,http://amanivehiclesounds.co.ke/product/panel-for-toyota-allion-premio,http://amanivehiclesounds.co.ke/uploads/product/Panel-for-Toyota-Allion--&-Premio-001.png,Others
237,Toyota Premio T260 Allion 2007 - 2010,car stereo console fascia for toyota premio T260 Toyota allion,In Stock,new,6500,http://amanivehiclesounds.co.ke/product/toyota-premio-t260-allion-2007-2010,http://amanivehiclesounds.co.ke/uploads/product/Toyota-Premio-T260-Allion-2007---2010-001.png,Others
238,Alphard 2008+ console,Double Din Radio Fascia Console for Alphard radio installation.,In Stock,new,"11,000",http://amanivehiclesounds.co.ke/product/alphard-2008-console,http://amanivehiclesounds.co.ke/uploads/product/Alphard-2008+-console-001.png,Others
239,Toyota Alphard & Velfire 2015+ Trim,Double Din Car Radio Conversion kit for Toyota Alphard & Velfire 2015+,In Stock,new,7500,http://amanivehiclesounds.co.ke/product/toyota-alphard-velfire-2015-trim,http://amanivehiclesounds.co.ke/uploads/product/Toyota-Alphard-&-Velfire-2015+-Trim-001.png,Others
240,Radio Trim for Toyota Auris 2006-2012,Toyota Auris Car Radio Conversion kit,In Stock,new,6000,http://amanivehiclesounds.co.ke/product/radio-trim-for-toyota-auris-2006-2012,http://amanivehiclesounds.co.ke/uploads/product/Radio-Trim-for-Toyota-Auris-2006-2012-001.png,Others
241,Fascia Panel for Toyota Avensis 2003,Car Radio Conversion Kit for Toyota Avensis  2003-2008,In Stock,new,6000,http://amanivehiclesounds.co.ke/product/fascia-panel-for-toyota-avensis-2003,http://amanivehiclesounds.co.ke/uploads/product/2019-08-1612:45:47imageDOUBLE-DIN-STEREO-FASCIA-PANEL-FOR-TOYOTA-AVENSIS-2003-2008.png,Others
242,Toyota Bb 2005 Subaru Dex 2008+ panel,Fascia Console For Toyota bB Car Radio Installation,In Stock,new,6500,http://amanivehiclesounds.co.ke/product/toyota-bb-2005-subaru-dex-2008-panel,http://amanivehiclesounds.co.ke/uploads/product/2019-08-1610:09:24imageCAR-RADIO-FASCIA-CONSOLE-FOR-2015+-SUBARU-LEGACY-OUTBACK.png,Others
243,Fascia Panel for Toyota Caldina,Toyota Caldina T240 Year 2002 to 2007 Double Din Radio Conversion kit,In Stock,new,6000,http://amanivehiclesounds.co.ke/product/fascia-panel-for-toyota-caldina,http://amanivehiclesounds.co.ke/uploads/product/2019-08-1612:49:37imageDOUBLE-DIN-STEREO-FASCIA-PANEL-FOR-TOYOTA-CALDINA-T240-YEAR-2002-TO-2007.png,Others
244,Toyota Aurion Camry radio trim kit,Toyota Camry Aurion double Din Stereo Conversion kit-Silver,In Stock,new,6500,http://amanivehiclesounds.co.ke/product/toyota-aurion-camry-radio-trim-kit,http://amanivehiclesounds.co.ke/uploads/product/2019-08-1612:55:41imageSTEREO-FASCIA-PANEL-FOR-TOYOTA-CAMRY-AURION-YEAR-2006-TO-2011.png,Others
245,Toyota Estima 2006 to 2016 Fascia kit,Toyota Estima Car Radio Installation Trim Fascia Panel,In Stock,new,6500,http://amanivehiclesounds.co.ke/product/toyota-estima-2006-to-2016-fascia-kit,http://amanivehiclesounds.co.ke/uploads/product/2019-08-1613:07:02imageDOUBLE-DIN-STEREO-FASCIA-PANEL-FOR-TOYOTA-ESTIMA-2006-TO-2016.png,Others
246,Toyota Hilux Vigo Fortuner Frame kit,Car Radio Installation Trim Fascia Panel For Toyota Hilux Vigo Fortuner 2011+,In Stock,new,5500,http://amanivehiclesounds.co.ke/product/toyota-hilux-vigo-fortuner-frame-kit,http://amanivehiclesounds.co.ke/uploads/product/2019-08-1613:16:00imageRADIO-FASCIA-FRAME-KIT-FOR-TOYOTA-HILUX-VIGO-FORTUNER-2011+.png,Others
247,Fascia Panel for Toyota Isis 2004+,Radio Installation Conversion kit for Toyota ISIS 2004,In Stock,new,6000,http://amanivehiclesounds.co.ke/product/fascia-panel-for-toyota-isis-2004,http://amanivehiclesounds.co.ke/uploads/product/2019-08-1613:20:46imageDOUBLE-DIN-STEREO-FASCIA-PANEL-FOR-TOYOTA-ISIS-2004+.png,Others
248,Toyota Landcruiser 200 YR 2008-2015,Toyota Landcruiser V8 Radio Conversion kit,In Stock,new,7000,http://amanivehiclesounds.co.ke/product/toyota-landcruiser-200-yr-2008-2015,http://amanivehiclesounds.co.ke/uploads/product/2019-08-1615:51:57imageRADIO-FASCIA-FRAME-KIT-FOR-TOYOTA-LANDCRUISER-200-V8-YEAR-2008-TO-2015.png,Others
249,Toyota Landcruiser Vx100 Trim kit,Double Din Fascia Panel for Toyota Landcruiser VX100 2003-2008 and Lexus LX-470 year: 1998-2007,In Stock,new,6000,http://amanivehiclesounds.co.ke/product/toyota-landcruiser-vx100-trim-kit,http://amanivehiclesounds.co.ke/uploads/product/2019-08-1616:03:48imageDOUBLE-DIN-RADIO-FASCIA-FOR-TOYOTA-LANDCRUISER-VX100-YEAR-2003-TO-2008-LEXUS-LX470.png,Others
250,Toyota Passo 2011 Fascia Panel,Fascia Radio conversion kit for Toyota Passo 2011,In Stock,new,7000,http://amanivehiclesounds.co.ke/product/toyota-passo-2011-fascia-panel,http://amanivehiclesounds.co.ke/uploads/product/2019-08-1616:14:47imageDOUBLE-DIN-STEREO-FASCIA-PANEL-FOR-TOYOTA-PASSO-2011.png,Others
251,Prado 120  Lexus Gx470 2002-2009 Trim,Car Radio Conversion kit for Toyota Prado 120 Lexus GX470,In Stock,new,6500,http://amanivehiclesounds.co.ke/product/prado-120-lexus-gx470-2002-2009-trim,http://amanivehiclesounds.co.ke/uploads/product/Prado-120--Lexus-Gx470-2002-2009-Trim-001.png,Others
252,Toyota Prado 150 2014+ Radio Trim kit,Toyota Prado 150 Car Radio Conversion kit  Black silver color,In Stock,new,9000,http://amanivehiclesounds.co.ke/product/toyota-prado-150-2014-radio-trim-kit,http://amanivehiclesounds.co.ke/uploads/product/Toyota-Prado-150-2014+-Radio-Trim-kit-001.png,Others
253,Toyota Prado Gx 150 Year 2010,Car Radio Conversion kit For Toyota Prado GX 150,In Stock,new,9000,http://amanivehiclesounds.co.ke/product/toyota-prado-gx-150-year-2010,http://amanivehiclesounds.co.ke/uploads/product/Toyota-Prado-Gx-150-Year-2010-001.png,Others
254,Toyota Prius 2010 Car Radio Fascia,Car Radio installation fascia kit for Toyota Prius 2010,In Stock,new,6500,http://amanivehiclesounds.co.ke/product/toyota-prius-2010-car-radio-fascia,http://amanivehiclesounds.co.ke/uploads/product/Toyota-Prius-2010-Car-Radio-Fascia-001.png,Others
255,Toyota Ractis Radio Installation kit.,Double Din Toyota Verso-s Ractis & Subaru Trezia 2010+ Car Radio Fascia Installation Kit,In Stock,new,7000,http://amanivehiclesounds.co.ke/product/toyota-ractis-radio-installation-kit,http://amanivehiclesounds.co.ke/uploads/product/Toyota-Ractis-Radio-Installation-kit.-001.png,Others
256,Toyota Rav 4 Radio replacement.,Car Radio Conversion kit for Toyota RAV 4 year 2006 to 2012,In Stock,new,6500,http://amanivehiclesounds.co.ke/product/toyota-rav-4-radio-replacement,http://amanivehiclesounds.co.ke/uploads/product/Toyota-Rav-4-Radio-replacement.-001.png,Others
257,Toyota RAV 4 Yr 2013+ Trim Kit,Car Radio Conversion kit for Toyota RAV 4 2013,In Stock,new,7000,http://amanivehiclesounds.co.ke/product/toyota-rav-4-yr-2013-trim-kit,http://amanivehiclesounds.co.ke/uploads/product/Toyota-RAV-4-Yr-2013+-Trim-Kit-001.png,Others
258,Mark X 2009+ Radio Trim kit,Toyota Mark X Reiz Stereo Fascia Dash Trim Installation Kit,In Stock,new,6500,http://amanivehiclesounds.co.ke/product/mark-x-2009-radio-trim-kit,http://amanivehiclesounds.co.ke/uploads/product/Mark-X-2009+-Radio-Trim-kit-001.png,Others
259,Toyota Rush 2006 + Radio Trim Kit,Radio Fascia kit for Toyota Ruish 2006+,In Stock,new,7000,http://amanivehiclesounds.co.ke/product/toyota-rush-2006-radio-trim-kit,http://amanivehiclesounds.co.ke/uploads/product/Toyota-Rush-2006-+-Radio-Trim-Kit-001.png,Others
260,Toyota Vios Belta Yaris Sedan 2006+,Double Din Car Radio conversion kit for Toyota Belta,In Stock,new,6000,http://amanivehiclesounds.co.ke/product/toyota-vios-belta-yaris-sedan-2006,http://amanivehiclesounds.co.ke/uploads/product/Toyota-Vios-Belta-Yaris-Sedan-2006+-001.png,Others
261,Fascia Panel for Toyota Vitz 2013+,Double Din Conversion kit for Toyota Vitz Vios 2013+,In Stock,new,8000,http://amanivehiclesounds.co.ke/product/fascia-panel-for-toyota-vitz-2013,http://amanivehiclesounds.co.ke/uploads/product/Fascia-Panel-for-Toyota-Vitz-2013+-001.png,Others
262,Fascia Panel for Toyota Vista Ardeo,2 Din Radio Conversion kit for Toyota Vista Ardeo 2005,In Stock,new,6500,http://amanivehiclesounds.co.ke/product/fascia-panel-for-toyota-vista-ardeo,http://amanivehiclesounds.co.ke/uploads/product/Fascia-Panel-for-Toyota-Vista-Ardeo-001.png,Others
263,Stereo Fascia Panel for Toyota Vitz,Radio Conversion Kit for Toyota Yaris Echo Vitz 1995 to 2005,In Stock,new,6000,http://amanivehiclesounds.co.ke/product/stereo-fascia-panel-for-toyota-vitz,http://amanivehiclesounds.co.ke/uploads/product/Stereo-Fascia-Panel-for-Toyota-Vitz-001.png,Others
264,Toyota Vitz Yaris Car Radio Fascia,Car Radio Conversion Kit for Toyota Vitz Yaris 2012,In Stock,new,6500,http://amanivehiclesounds.co.ke/product/toyota-vitz-yaris-car-radio-fascia,http://amanivehiclesounds.co.ke/uploads/product/Toyota-Vitz-Yaris-Car-Radio-Fascia-001.png,Others
265,Toyota Vitz Platz 2005 to 2011 Fascia,fascia conversion kit for toyota yaris vitz 2005 TO 2011,In Stock,new,7000,http://amanivehiclesounds.co.ke/product/toyota-vitz-platz-2005-to-2011-fascia,http://amanivehiclesounds.co.ke/uploads/product/Toyota-Vitz-Platz-2005-to-2011-Fascia-001.png,Others
266,12 Inch Speaker Cabinet With One Brea,bass speaker enclosure with one breather,In Stock,new,3500,http://amanivehiclesounds.co.ke/product/12-inch-speaker-cabinet-with-one-brea,http://amanivehiclesounds.co.ke/uploads/product/12-Inch-Speaker-Cabinet-With-One-Brea-001.png,Others
267,12 Inch Speaker Cabinet With Two Brea,ported Bass Speaker enclosure.,In Stock,new,3500,http://amanivehiclesounds.co.ke/product/12-inch-speaker-cabinet-with-two-brea,http://amanivehiclesounds.co.ke/uploads/product/12-Inch-Speaker-Cabinet-With-Two-Brea-001.png,Others
268,3 in 1 Speaker Cabinet,12 Inch & 6*9 Inch  3 in 1 ported speaker cabinet,In Stock,new,6000,http://amanivehiclesounds.co.ke/product/3-in-1-speaker-cabinet,http://amanivehiclesounds.co.ke/uploads/product/3-in-1-Speaker-Cabinet-001.png,Others
269,Oval Speaker Cabinet,6*9 Inch Oval speaker sealed enclosure cabinet.,In Stock,new,900,http://amanivehiclesounds.co.ke/product/oval-speaker-cabinet,http://amanivehiclesounds.co.ke/uploads/product/Oval-Speaker-Cabinet-001.png,Others
270,6*9 Inch Slant Speaker Cabinet,Slant midrange oval speaker box.,In Stock,new,1000,http://amanivehiclesounds.co.ke/product/69-inch-slant-speaker-cabinet,http://amanivehiclesounds.co.ke/uploads/product/6*9-Inch-Slant-Speaker-Cabinet-001.png,Others
271,6 Inch Speaker Cabinet,Door Speakers Enclosure,In Stock,new,800,http://amanivehiclesounds.co.ke/product/6-inch-speaker-cabinet,http://amanivehiclesounds.co.ke/uploads/product/6-Inch-Speaker-Cabinet-001.png,Others
272,12 Inch Speaker Bass Tube,"12"" Bass tube sealed enclosure.",In Stock,new,3000,http://amanivehiclesounds.co.ke/product/12-inch-speaker-bass-tube,http://amanivehiclesounds.co.ke/uploads/product/12-Inch-Speaker-Bass-Tube-001.png,Others
273,Double 6*9 Inch Speaker Cabinet,Oval Speakers Cabinet with Breather.,In Stock,new,2500,http://amanivehiclesounds.co.ke/product/double-69-inch-speaker-cabinet,http://amanivehiclesounds.co.ke/uploads/product/Double-6*9-Inch-Speaker-Cabinet-001.png,Others
274,12 Inch Speaker Slot Bass Box,Slot Bass Speaker Cabinet,In Stock,new,4000,http://amanivehiclesounds.co.ke/product/12-inch-speaker-slot-bass-box,http://amanivehiclesounds.co.ke/uploads/product/12-Inch-Speaker-Slot-Bass-Box-001.png,Others
275,Space Saving 12 Inch Bass Speaker Cabinet,Enclosed space saving box,In Stock,new,2700,http://amanivehiclesounds.co.ke/product/space-saving-12-inch-bass-speaker-cabinet,http://amanivehiclesounds.co.ke/uploads/product/Space-Saving-12-Inch-Bass-Speaker-Cabinet-001.png,Others
276,Double 12 Inch Speaker Cabinet,"This is a quality cabinet made to fit two 12""  Bass Speakers.  .",In Stock,new,6500,http://amanivehiclesounds.co.ke/product/double-12-inch-speaker-cabinet,http://amanivehiclesounds.co.ke/uploads/product/Double-12-Inch-Speaker-Cabinet-001.png,Others
277,Pioneer Ts-r1651s Door Speakers,6.5 inch 300 watts car speakers.,In Stock,new,2999,http://amanivehiclesounds.co.ke/product/pioneer-ts-r1651s-door-speakers,http://amanivehiclesounds.co.ke/uploads/product/Pioneer-Ts-r1651s-Door-Speakers-001.png,Pioneer
278,Car Sub woofer with 1400W Max power,Pioneer TS-W311S4 Dual magnet subwoofer with powerful bass,In Stock,new,6500,http://amanivehiclesounds.co.ke/product/car-sub-woofer-with-1400w-max-power,http://amanivehiclesounds.co.ke/uploads/product/Car-Sub-woofer-with-1400W-Max-power-001.png,Pioneer
279,Champion series Pioneer Bass Speaker,TS-W300D4 Pioneer Car Subwoofer,In Stock,new,6499,http://amanivehiclesounds.co.ke/product/champion-series-pioneer-bass-speaker,http://amanivehiclesounds.co.ke/uploads/product/Champion-series-Pioneer-Bass-Speaker-001.png,Pioneer
280,Pioneer TS-D12D2 Double Coil Bass Spe,Pioneer Dual voice coil car sub woofer.,In Stock,new,9999,http://amanivehiclesounds.co.ke/product/pioneer-ts-d12d2-double-coil-bass-spe,http://amanivehiclesounds.co.ke/uploads/product/Pioneer-TS-D12D2-Double-Coil-Bass-Spe-001.png,Pioneer
281,Universal Car Smartphone holder -Black,Air vent Car mount,In Stock,new,999,http://amanivehiclesounds.co.ke/product/universal-car-smartphone-holder-black,http://amanivehiclesounds.co.ke/uploads/product/Universal-Car-Smartphone-holder--Black-001.png,Others
282,Universal Car Smartphone mount - Red,Red car smartphone holder,In Stock,new,999,http://amanivehiclesounds.co.ke/product/universal-car-smartphone-mount-red,http://amanivehiclesounds.co.ke/uploads/product/Universal-Car-Smartphone-mount---Red-001.png,Others
283,Blue Air Vent Car  Smartphone holder,"car phone holder, air vent mount.",In Stock,new,999,http://amanivehiclesounds.co.ke/product/blue-air-vent-car-smartphone-holder,http://amanivehiclesounds.co.ke/uploads/product/Blue-Air-Vent-Car--Smartphone-holder-001.png,Others
284,Classy car phone holder-black,"air vent mount, car smartphone holder.",In Stock,new,1399,http://amanivehiclesounds.co.ke/product/classy-car-phone-holder-black,http://amanivehiclesounds.co.ke/uploads/product/Classy-car-phone-holder-black-001.png,Others
285,Sony Car Stereo System WX-900BT,"Double Din radio with Bluetooth, CD Player.",In Stock,new,13000,http://amanivehiclesounds.co.ke/product/sony-car-stereo-system-wx-900bt,http://amanivehiclesounds.co.ke/uploads/product/Sony-Car-Stereo-System-WX-900BT-001.png,Sony
286,Sony XAV-AX1000 Car Stereo,Car stereo system with Navigation with Apple carPlay.,In Stock,new,19999,http://amanivehiclesounds.co.ke/product/sony-xav-ax1000-car-stereo,http://amanivehiclesounds.co.ke/uploads/product/Sony-XAV-AX1000-Car-Stereo-001.png,Sony
287,Sony Car Stereo system XAV-AX3000,Car stereo with apple CarPlay & Android Auto,In Stock,new,35000,http://amanivehiclesounds.co.ke/product/sony-car-stereo-system-xav-ax3000,http://amanivehiclesounds.co.ke/uploads/product/Sony-Car-Stereo-system-XAV-AX3000-001.png,Sony
288,JVC Bluetooth Radio Receiver with USB,Car Radio Bluetooth Receiver.,In Stock,new,7500,http://amanivehiclesounds.co.ke/product/jvc-bluetooth-radio-receiver-with-usb,http://amanivehiclesounds.co.ke/uploads/product/JVC-Bluetooth-Radio-Receiver-with-USB-001.png,JVC
289,Pioneer  TS-A1680F Door Speakers.,350 Watts High performance door speakers with 80W RMS Power.,In Stock,new,6499,http://amanivehiclesounds.co.ke/product/pioneer-ts-a1680f-door-speakers,http://amanivehiclesounds.co.ke/uploads/product/Pioneer--TS-A1680F-Door-Speakers.-001.png,Pioneer
290,"Sony XS-XB1641 4 Way Speakers, 6.5""",Door Speakers with 350W Max power output.,In Stock,new,5500,http://amanivehiclesounds.co.ke/product/sony-xs-xb1641-4-way-speakers-65,"http://amanivehiclesounds.co.ke/uploads/product/Sony-XS-XB1641-4-Way-Speakers,-6.5""-001.png",Sony
291,Pioneer TS-A30S4 1400W Subwoofer,1400W Car Bass Speaker,In Stock,new,5000,http://amanivehiclesounds.co.ke/product/pioneer-ts-a30s4-1400w-subwoofer,http://amanivehiclesounds.co.ke/uploads/product/Pioneer-TS-A30S4-1400W-Subwoofer-001.png,Pioneer
292,MVH-S325BT Car Stereo with Bluetooth,"Car Multimedia Tuner with Dual Bluetooth, Spotify, Smartphone connectivity & Siri Eyes Free.",In Stock,new,8500,http://amanivehiclesounds.co.ke/product/mvh-s325bt-car-stereo-with-bluetooth,http://amanivehiclesounds.co.ke/uploads/product/Pioneer-MVH-S325BT-Car-Stereo-with-Bluetooth-hands-free-Calling.-001.png,Pioneer
293,Sony XAV-1500 Car Radio with weblink cast,Enjoy mirrored smartphone contents with WebLink™ Cast on this Sony car radio.,In Stock,new,22000,http://amanivehiclesounds.co.ke/product/sony-xav-1500-car-radio-with-weblink-cast,http://amanivehiclesounds.co.ke/uploads/product/Sony-XAV-1500-Car-Radio-with-weblink-cast-001.png,Others
